{
  "schema_version": 1,
  "target_ref": "rsjwqmpseknvydistgfr",
  "production_ref_denied": "wajkfydxutptcvvfwrvq",
  "source_sha256": "d05e853bf1447e9df3493eea1fd8c2893f8b535b940ff091646ec35c0293f701",
  "run_id": "f1a20260821000000000000000000001",
  "cases": [
    {
      "name": "QA_IDEMPOTENCIA_MISMA_CLAVE_HASH",
      "query_a": "begin;\nset local search_path='';\nset local statement_timeout='30s';\nset local lock_timeout='5s';\ncreate temporary table alq_f1a_qualification_context(\n  run_id uuid primary key) on commit drop;\ninsert into pg_temp.alq_f1a_qualification_context(run_id)\nvalues ('f1a20260-8210-0000-0000-000000000001'::uuid);\nselect pg_catalog.set_config('application_name',\n  'alq_f1a_barrier:f1a20260821000000000000000000001:QA_IDEMPOTENCIA_MISMA_CLAVE_HASH:A',false);\nselect pg_catalog.set_config('request.jwt.claim.sub',(\n  select pu.auth_user_id::text\n  from alq.alq_capacidad_admin ca\n  join alq.alq_parte_usuario pu on pu.id=ca.parte_usuario_id\n  where statement_timestamp()<@ca.vigencia\n    and statement_timestamp()<@pu.vigencia\n  order by ca.id limit 1),true);\nselect pg_catalog.set_config('request.jwt.claim.role','authenticated',true);\nselect pg_catalog.set_config('request.jwt.claims',(\n  select jsonb_build_object('sub',pu.auth_user_id,'role','authenticated',\n    'app_metadata',jsonb_build_object('rol','admin'))::text\n  from alq.alq_capacidad_admin ca\n  join alq.alq_parte_usuario pu on pu.id=ca.parte_usuario_id\n  where statement_timestamp()<@ca.vigencia\n    and statement_timestamp()<@pu.vigencia\n  order by ca.id limit 1),true);\ncreate temporary table alq_f1a_barrier_peer(pid integer primary key) on commit drop;\ncreate temporary table alq_f1a_side_result(envelope jsonb not null) on commit drop;\ndo $alq_f1a_barrier$\ndeclare\n  v_peer integer;\n  v_deadline timestamptz:=clock_timestamp()+interval '10 seconds';\n  v_envelope jsonb;\nbegin\n  perform pg_catalog.pg_advisory_xact_lock(pg_catalog.hashtextextended(\n    'alq_f1a_barrier:signal:f1a20260821000000000000000000001:QA:A',0));\n  loop\n    select a.pid into v_peer\n    from pg_catalog.pg_stat_activity a\n    where a.datname=current_database()\n      and a.pid<>pg_catalog.pg_backend_pid()\n      and a.application_name='alq_f1a_barrier:f1a20260821000000000000000000001:QA_IDEMPOTENCIA_MISMA_CLAVE_HASH:B'\n    order by a.pid limit 1;\n    exit when found;\n    if clock_timestamp()>=v_deadline then\n      raise exception 'ALQ_F1A_QA_BARRIER_PEER_TIMEOUT';\n    end if;\n    perform pg_catalog.pg_sleep(0.02);\n  end loop;\n  insert into pg_temp.alq_f1a_barrier_peer values(v_peer);\n  v_envelope:=public.alq_admin_preparar_v2(\n    'f1a20260-8210-4000-8000-00000000000a'::uuid,\n    'nota_emitir',\n    jsonb_build_object(\n      'nota_ref','f1a20260-8210-4000-8000-0000000000aa',\n      'tipo','credito',\n      'cargo_id','f1a20260-8210-4000-8000-0000000000cc',\n      'monto',1,'moneda','ARS',\n      'motivo','calificacion sintetica F1-A',\n      'fecha','2026-08-21T12:00:00Z'));\n  if v_envelope->>'estado'<>'rechazada_sin_fila'\n     or v_envelope->>'codigo'<>'ALQ_F1A_REFERENCIA_NO_EXISTE'\n     or coalesce((v_envelope->>'ok')::boolean,true) then\n    raise exception 'ALQ_F1A_QA_RECHAZO_SIN_FILA_INVALIDO';\n  end if;\n  insert into pg_temp.alq_f1a_side_result values(v_envelope);\nend\n$alq_f1a_barrier$;\nselect 'ALQ_F1A_CONCURRENCY_SIDE|'||jsonb_build_object(\n  'schema_version',1,\n  'run_id','f1a20260821000000000000000000001',\n  'source_sha256','d05e853bf1447e9df3493eea1fd8c2893f8b535b940ff091646ec35c0293f701',\n  'captured_utc',to_char(clock_timestamp() at time zone 'UTC',\n    'YYYY-MM-DD\"T\"HH24:MI:SS\"Z\"'),\n  'case','QA_IDEMPOTENCIA_MISMA_CLAVE_HASH',\n  'side','A',\n  'status','RECHAZADA_SIN_FILA',\n  'pid',pg_catalog.pg_backend_pid(),\n  'peer_pid',(select pid from pg_temp.alq_f1a_barrier_peer),\n  'barrier_observed',true,\n  'financial_success',false,\n  'residual_rows',0);\ncommit;",
      "query_b": "begin;\nset local search_path='';\nset local statement_timeout='30s';\nset local lock_timeout='5s';\ncreate temporary table alq_f1a_qualification_context(\n  run_id uuid primary key) on commit drop;\ninsert into pg_temp.alq_f1a_qualification_context(run_id)\nvalues ('f1a20260-8210-0000-0000-000000000001'::uuid);\nselect pg_catalog.set_config('application_name',\n  'alq_f1a_barrier:f1a20260821000000000000000000001:QA_IDEMPOTENCIA_MISMA_CLAVE_HASH:B',false);\nselect pg_catalog.set_config('request.jwt.claim.sub',(\n  select pu.auth_user_id::text\n  from alq.alq_capacidad_admin ca\n  join alq.alq_parte_usuario pu on pu.id=ca.parte_usuario_id\n  where statement_timestamp()<@ca.vigencia\n    and statement_timestamp()<@pu.vigencia\n  order by ca.id limit 1),true);\nselect pg_catalog.set_config('request.jwt.claim.role','authenticated',true);\nselect pg_catalog.set_config('request.jwt.claims',(\n  select jsonb_build_object('sub',pu.auth_user_id,'role','authenticated',\n    'app_metadata',jsonb_build_object('rol','admin'))::text\n  from alq.alq_capacidad_admin ca\n  join alq.alq_parte_usuario pu on pu.id=ca.parte_usuario_id\n  where statement_timestamp()<@ca.vigencia\n    and statement_timestamp()<@pu.vigencia\n  order by ca.id limit 1),true);\ncreate temporary table alq_f1a_barrier_peer(pid integer primary key) on commit drop;\ncreate temporary table alq_f1a_side_result(envelope jsonb not null) on commit drop;\ndo $alq_f1a_barrier$\ndeclare\n  v_peer integer;\n  v_deadline timestamptz:=clock_timestamp()+interval '10 seconds';\n  v_envelope jsonb;\nbegin\n  perform pg_catalog.pg_advisory_xact_lock(pg_catalog.hashtextextended(\n    'alq_f1a_barrier:signal:f1a20260821000000000000000000001:QA:B',0));\n  loop\n    select a.pid into v_peer\n    from pg_catalog.pg_stat_activity a\n    where a.datname=current_database()\n      and a.pid<>pg_catalog.pg_backend_pid()\n      and a.application_name='alq_f1a_barrier:f1a20260821000000000000000000001:QA_IDEMPOTENCIA_MISMA_CLAVE_HASH:A'\n    order by a.pid limit 1;\n    exit when found;\n    if clock_timestamp()>=v_deadline then\n      raise exception 'ALQ_F1A_QA_BARRIER_PEER_TIMEOUT';\n    end if;\n    perform pg_catalog.pg_sleep(0.02);\n  end loop;\n  insert into pg_temp.alq_f1a_barrier_peer values(v_peer);\n  v_envelope:=public.alq_admin_preparar_v2(\n    'f1a20260-8210-4000-8000-00000000000b'::uuid,\n    'nota_emitir',\n    jsonb_build_object(\n      'nota_ref','f1a20260-8210-4000-8000-0000000000aa',\n      'tipo','credito',\n      'cargo_id','f1a20260-8210-4000-8000-0000000000cc',\n      'monto',1,'moneda','ARS',\n      'motivo','calificacion sintetica F1-A',\n      'fecha','2026-08-21T12:00:00Z'));\n  if v_envelope->>'estado'<>'rechazada_sin_fila'\n     or v_envelope->>'codigo'<>'ALQ_F1A_REFERENCIA_NO_EXISTE'\n     or coalesce((v_envelope->>'ok')::boolean,true) then\n    raise exception 'ALQ_F1A_QA_RECHAZO_SIN_FILA_INVALIDO';\n  end if;\n  insert into pg_temp.alq_f1a_side_result values(v_envelope);\nend\n$alq_f1a_barrier$;\nselect 'ALQ_F1A_CONCURRENCY_SIDE|'||jsonb_build_object(\n  'schema_version',1,\n  'run_id','f1a20260821000000000000000000001',\n  'source_sha256','d05e853bf1447e9df3493eea1fd8c2893f8b535b940ff091646ec35c0293f701',\n  'captured_utc',to_char(clock_timestamp() at time zone 'UTC',\n    'YYYY-MM-DD\"T\"HH24:MI:SS\"Z\"'),\n  'case','QA_IDEMPOTENCIA_MISMA_CLAVE_HASH',\n  'side','B',\n  'status','RECHAZADA_SIN_FILA',\n  'pid',pg_catalog.pg_backend_pid(),\n  'peer_pid',(select pid from pg_temp.alq_f1a_barrier_peer),\n  'barrier_observed',true,\n  'financial_success',false,\n  'residual_rows',0);\ncommit;",
      "expected_status_a": "RECHAZADA_SIN_FILA",
      "expected_status_b": "RECHAZADA_SIN_FILA",
      "expected_financial_successes": 0
    }
  ]
}
